<?xml version="1.0" encoding="UTF-8"?>
<!--

    (C) Copyright 2011-2015 FastConnect SAS
    (http://www.fastconnect.fr/) and others.

    Licensed under the Apache License, Version 2.0 (the "License");
    you may not use this file except in compliance with the License.
    You may obtain a copy of the License at

        http://www.apache.org/licenses/LICENSE-2.0

    Unless required by applicable law or agreed to in writing, software
    distributed under the License is distributed on an "AS IS" BASIS,
    WITHOUT WARRANTIES OR CONDITIONS OF ANY KIND, either express or implied.
    See the License for the specific language governing permissions and
    limitations under the License.

-->

<xs:schema xmlns:xs="http://www.w3.org/2001/XMLSchema"
	 xmlns:lang="http://fastconnect.fr/Lang.xsd"
	 targetNamespace="http://fastconnect.fr/Lang.xsd"
	 elementFormDefault="qualified"
	 attributeFormDefault="unqualified">
	<xs:element name="lang">
		<xs:complexType>
			<xs:sequence>
				<xs:element ref="lang:word" minOccurs="0" maxOccurs="unbounded"/>
			</xs:sequence>
			<xs:attribute name="lang" type="xs:string" use="required"/>
		</xs:complexType>
	</xs:element>
	<xs:element name="word">
		<xs:complexType>
			<xs:simpleContent>
				<xs:extension base="xs:string">
					<xs:attribute name="key" type="xs:string" use="required"/>
				</xs:extension>
			</xs:simpleContent>
		</xs:complexType>
	</xs:element>
</xs:schema>