<?xml version = "1.0" encoding = "UTF-8"?>
<!--

    (C) Copyright 2011-2015 FastConnect SAS
    (http://www.fastconnect.fr/) and others.

    Licensed under the Apache License, Version 2.0 (the "License");
    you may not use this file except in compliance with the License.
    You may obtain a copy of the License at

        http://www.apache.org/licenses/LICENSE-2.0

    Unless required by applicable law or agreed to in writing, software
    distributed under the License is distributed on an "AS IS" BASIS,
    WITHOUT WARRANTIES OR CONDITIONS OF ANY KIND, either express or implied.
    See the License for the specific language governing permissions and
    limitations under the License.

-->
<lang lang = "FR" xmlns = "http://fastconnect.fr/Lang.xsd" xmlns:xsi = "http://www.w3.org/2001/XMLSchema-instance" xsi:schemaLocation = "http://fastconnect.fr/Lang.xsd ../XSD/Lang.xsd">
	<word key = "Above max process call depth for analysis">A delà du seuil de profondeur d'appels durant l'analyse</word>
	<word key = "Activities count">Nombre d'activités</word>
	<word key = "Activity">Activité</word>
	<word key = "Binaries">Binaires</word>
	<word key = "Color">Couleur</word>
	<word key = "Condition">Condition</word>
	<word key = "Configuration">Configuration</word>
	<word key = "ConfigurationEntry">Paramètre</word>
	<word key = "Context">Contexte</word>
	<word key = "Disabled">Désactivé</word>
	<word key = "EFF">Efficacité</word>
	<word key = "EFF-001">Boucles imbriquées, niveau d'imbrication >= </word>
	<word key = "EFF-002">Section critique autour d'une Job Shared Variable</word>
	<word key = "EFF-003">Section critique autour d'un accès isolé à une Shared Variable</word>
	<word key = "EFF-004">Utilisation de l'activité Get JMS Queue Message</word>
	<word key = "EFF-005">Selectors JMS</word>
	<word key = "EFF-006">Utilisation des activités JMS synchrones</word>
	<word key = "ERR">Erreurs</word>
	<word key = "Error">Erreur</word>
	<word key = "File">Fichier</word>
	<word key = "Files">Fichiers</word>
	<word key = "From">De</word>
	<word key = "GEN">Général</word>
	<word key = "GEN-001">Informations générales</word>
	<word key = "GEN-002">Connexions non configurables</word>
	<word key = "GEN-003">Target namespace non-défini</word>
	<word key = "GEN-004">Collision de namespace</word>
	<word key = "Group">Groupe</word>
	<word key = "Informations">Informations</word>
	<word key = "Leaf Processes">Sous-processus</word>
	<word key = "Leaf process">Sous-processus</word>
	<word key = "MAI">Maintenabilité</word>
	<word key = "MAI-001">Couleurs utilisées pour les transitions</word>
	<word key = "MAI-002">Appels dynamiques de sous-process</word>
	<word key = "MAI-003">Appels consécutifs de sous-process >= </word>
	<word key = "MAI-004">Extensions Java XPath</word>
	<word key = "MAI-005">Imports de librairies invalides</word>
	<word key = "MAI-006">Mapper d'entrée complexe, > </word>
	<word key = "MAI-007">Nombre d'activités par processus > </word>
	<word key = "MAI-008">Processus non-commentés</word>
	<word key = "MAI-009">Processus trop grands, > </word>
	<word key = "MAI-010">Transitions sans label</word>
	<word key = "MAI-011">Starter avec schéma de sortie</word>
	<word key = "Max depth">Profondeur max</word>
	<word key = "Namespace">Namespace</word>
	<word key = "Not well formed connection">Connexion</word>
	<word key = "Number of activities">Nombre d'activités : </word>
	<word key = "Number of adapter archives">Nombre d'adapter archives (aar) : </word>
	<word key = "Number of enterprise archives">Nombre d'entreprise archives (ear) : </word>
	<word key = "Number of files">Nombre de fichiers : </word>
	<word key = "Number of process archives">Nombre de process archives (par) : </word>
	<word key = "Number of processes">Nombre de processus : </word>
	<word key = "Number of project libraries builder">Nombre de library builder : </word>
	<word key = "Number of project libraries used">Nombre de librairies utilisées : </word>
	<word key = "POR">Portabilité</word>
	<word key = "POR-001">Utilisation de l'activité External Command</word>
	<word key = "POR-002">Utilisation des activités Java</word>
	<word key = "Process">Processus</word>
	<word key = "Processes">Processus</word>
	<word key = "Property">Propriété</word>
	<word key = "REL">Fiabilité</word>
	<word key = "REL-001">Appels récursifs</word>
	<word key = "REL-002">Transactions imbriquées</word>
	<word key = "REL-003">Utilisations de l'activité JDBC SQL Direct</word>
	<word key = "REL-004">Prioriétés JMS inconnues</word>
	<word key = "REL-005">Activités sans transition de sortie</word>
	<word key = "REL-006">Transition otherwise manquante</word>
	<word key = "Reason">Détection</word>
	<word key = "Recursion checked">Récursion vérifiée</word>
	<word key = "Resource">Ressource</word>
	<word key = "Resources">Ressource</word>
	<word key = "Rule">Règle</word>
	<word key = "Stack">Stack</word>
	<word key = "Sources">Sources</word>
	<word key = "To">Vers</word>
	<word key = "Transition type">Type de transition</word>
	<word key = "Value">Valeur</word>
	<word key = "XPath">XPath</word>
	<word key = "subtitle">pour TIBCO BusinessWorks</word>
	<word key = "title">FC Code Review</word>
</lang>